{
    "$schema": "http://json-schema.org/draft-06/schema#",
    "$ref": "#/definitions/Welcome4",
    "definitions": {
        "Welcome4": {
            "type": "object",
            "additionalProperties": false,
            "properties": {
                "id": {
                    "type": "string"
                },
                "schema_version": {
                    "type": "string"
                },
                "created_at": {
                    "type": "string",
                    "format": "date-time"
                },
                "updated_at": {
                    "type": "string",
                    "format": "date-time"
                },
                "tags": {
                    "type": "array",
                    "items": {
                        "type": "string"
                    }
                },
                "ble_registered_devices": {
                    "type": "array",
                    "items": {
                        "$ref": "#/definitions/BleRegisteredDevice"
                    }
                },
                "devices": {
                    "type": "array",
                    "items": {
                        "$ref": "#/definitions/Device"
                    }
                }
            },
            "required": [
                "ble_registered_devices",
                "created_at",
                "devices",
                "id",
                "schema_version",
                "tags",
                "updated_at"
            ],
            "title": "Welcome4"
        },
        "BleRegisteredDevice": {
            "type": "object",
            "additionalProperties": false,
            "properties": {
                "name": {
                    "type": "string"
                },
                "services": {
                    "type": "array",
                    "items": {
                        "type": "string"
                    }
                },
                "description": {
                    "type": "string"
                }
            },
            "required": [
                "description",
                "name",
                "services"
            ],
            "title": "BleRegisteredDevice"
        },
        "Device": {
            "type": "object",
            "additionalProperties": false,
            "properties": {
                "name": {
                    "type": "string"
                },
                "description": {
                    "type": "string"
                },
                "tags": {
                    "type": "array",
                    "items": {
                        "type": "string"
                    }
                },
                "ble": {
                    "$ref": "#/definitions/DeviceBle"
                },
                "global_config_values": {
                    "type": "array",
                    "items": {}
                },
                "data_streams": {
                    "type": "array",
                    "items": {
                        "$ref": "#/definitions/DataStream"
                    }
                }
            },
            "required": [
                "ble",
                "data_streams",
                "description",
                "global_config_values",
                "name",
                "tags"
            ],
            "title": "Device"
        },
        "DeviceBle": {
            "type": "object",
            "additionalProperties": false,
            "properties": {
                "ble_registered_services": {
                    "type": "array",
                    "items": {}
                },
                "info_service_uuid": {
                    "type": "string",
                    "format": "uuid"
                },
                "epoch_char_uuid": {
                    "type": "string",
                    "format": "uuid"
                }
            },
            "required": [
                "ble_registered_services",
                "epoch_char_uuid",
                "info_service_uuid"
            ],
            "title": "DeviceBle"
        },
        "DataStream": {
            "type": "object",
            "additionalProperties": false,
            "properties": {
                "id": {
                    "type": "string"
                },
                "name": {
                    "type": "string"
                },
                "description": {
                    "type": "string"
                },
                "include_anchor_timestamp": {
                    "type": "boolean"
                },
                "offset_data_value": {
                    "$ref": "#/definitions/DataValue"
                },
                "config_values": {
                    "type": "array",
                    "items": {
                        "$ref": "#/definitions/ConfigValue"
                    }
                },
                "data_values": {
                    "type": "array",
                    "items": {
                        "$ref": "#/definitions/DataValue"
                    }
                },
                "ble": {
                    "$ref": "#/definitions/DataStreamBle"
                }
            },
            "required": [
                "ble",
                "config_values",
                "data_values",
                "description",
                "id",
                "include_anchor_timestamp",
                "name",
                "offset_data_value"
            ],
            "title": "DataStream"
        },
        "DataStreamBle": {
            "type": "object",
            "additionalProperties": false,
            "properties": {
                "service_uuid": {
                    "type": "string",
                    "format": "uuid"
                },
                "data_char_uuid": {
                    "type": "string",
                    "format": "uuid"
                },
                "config_char_uuid": {
                    "type": "string",
                    "format": "uuid"
                }
            },
            "required": [
                "config_char_uuid",
                "data_char_uuid",
                "service_uuid"
            ],
            "title": "DataStreamBle"
        },
        "ConfigValue": {
            "type": "object",
            "additionalProperties": false,
            "properties": {
                "name": {
                    "type": "string"
                },
                "description": {
                    "type": "string"
                },
                "byte_start": {
                    "type": "integer"
                },
                "byte_end": {
                    "type": "integer"
                },
                "size": {
                    "type": "integer"
                },
                "unit": {
                    "anyOf": [
                        {
                            "type": "null"
                        },
                        {
                            "type": "string"
                        }
                    ]
                },
                "type": {
                    "$ref": "#/definitions/Type"
                },
                "default_value": {
                    "type": "string",
                    "format": "integer"
                },
                "options": {
                    "anyOf": [
                        {
                            "type": "array",
                            "items": {
                                "$ref": "#/definitions/Option"
                            }
                        },
                        {
                            "type": "null"
                        }
                    ]
                },
                "range": {
                    "anyOf": [
                        {
                            "$ref": "#/definitions/Range"
                        },
                        {
                            "type": "null"
                        }
                    ]
                }
            },
            "required": [
                "byte_end",
                "byte_start",
                "default_value",
                "description",
                "name",
                "options",
                "range",
                "size",
                "type",
                "unit"
            ],
            "title": "ConfigValue"
        },
        "Option": {
            "type": "object",
            "additionalProperties": false,
            "properties": {
                "name": {
                    "type": "string"
                },
                "description": {
                    "type": "string"
                },
                "value": {
                    "type": "string",
                    "format": "integer"
                }
            },
            "required": [
                "description",
                "name",
                "value"
            ],
            "title": "Option"
        },
        "Range": {
            "type": "object",
            "additionalProperties": false,
            "properties": {
                "start": {
                    "type": "integer"
                },
                "end": {
                    "type": "integer"
                },
                "step": {
                    "type": "integer"
                }
            },
            "required": [
                "end",
                "start",
                "step"
            ],
            "title": "Range"
        },
        "DataValue": {
            "type": "object",
            "additionalProperties": false,
            "properties": {
                "name": {
                    "type": "string"
                },
                "description": {
                    "type": "string"
                },
                "unit": {
                    "$ref": "#/definitions/Unit"
                },
                "byte_start": {
                    "type": "integer"
                },
                "byte_end": {
                    "type": "integer"
                },
                "size": {
                    "type": "integer"
                },
                "type": {
                    "$ref": "#/definitions/Type"
                },
                "multiplier": {
                    "anyOf": [
                        {
                            "type": "number"
                        },
                        {
                            "type": "null"
                        }
                    ]
                },
                "variable_type": {
                    "type": "string"
                },
                "depends_on": {
                    "type": "null"
                }
            },
            "required": [
                "byte_end",
                "byte_start",
                "description",
                "multiplier",
                "name",
                "size",
                "type",
                "unit"
            ],
            "title": "DataValue"
        },
        "Type": {
            "type": "string",
            "enum": [
                "int",
                "uint"
            ],
            "title": "Type"
        },
        "Unit": {
            "type": "string",
            "enum": [
                "",
                "arb",
                "ms"
            ],
            "title": "Unit"
        }
    }
}
