{
    "id": "flexiBLE-sample-spec",
    "schema_version": "0.3",
    "created_at": "2022-09-14T00:00:00.000Z",
    "updated_at": "2022-09-14T00:00:00.000Z",
    "tags": [
        "development"
    ],
    "ble_registered_devices": [
        {
            "name": "Polar H10 821A5D29",
            "services": [
                "heart-rate",
                "battery"
            ],
            "description": "a polar heart rate monitor for ground truth data collection"
        }
    ],
    "devices": [
        {
            "name": "FlexiBLE-pre-alpha",
            "description": "a locally stored file for nrf5340 device config",
            "tags": [
                "research"
            ],
            "ble": {
                "ble_registered_services": [],
                "info_service_uuid": "1a220001-c2ed-4d11-ad1e-fc06d8a02d37",
                "epoch_char_uuid": "1a220002-c2ed-4d11-ad1e-fc06d8a02d37"
            },
            "global_config_values": [],
            "data_streams": [
                {
                    "id": "0xb92c",
                    "name": "accelerometry",
                    "description": "Accelerometer sensor (x, y, z axis)",
                    "include_anchor_timestamp": true,
                    "offset_data_value": {
                        "name": "ms_offset",
                        "description": "relative time since the previous reading",
                        "unit": "ms",
                        "byte_start": 12,
                        "byte_end": 13,
                        "size": 1,
                        "type": "uint",
                        "multiplier": null,
                        "variable_type": "none"
                    },
                    "config_values": [
                        {
                            "name": "sensor_state",
                            "description": "state of the accelerometer sensor",
                            "byte_start": 0,
                            "byte_end": 1,
                            "size": 1,
                            "unit": null,
                            "type": "uint",
                            "default_value": "0",
                            "options": [
                                {
                                    "name": "disabled",
                                    "description": "the sensor will not stream data",
                                    "value": "0"
                                },
                                {
                                    "name": "streaming",
                                    "description": "the sensor will stream data",
                                    "value": "1"
                                }
                            ],
                            "range": null
                        },
                        {
                            "name": "desired_frequency",
                            "description": "the desired frequency of the sensor",
                            "byte_start": 1,
                            "byte_end": 3,
                            "size": 2,
                            "type": "uint",
                            "unit": "Hz",
                            "options": null,
                            "default_value": "10",
                            "range": {
                                "start": 20,
                                "end": 500,
                                "step": 20
                            }
                        },
                        {
                            "name": "batch_size",
                            "description": "the maximun size of payload",
                            "byte_start": 3,
                            "byte_end": 4,
                            "size": 1,
                            "type": "uint",
                            "unit": "bytes",
                            "options": null,
                            "default_value": "240",
                            "range": {
                                "start": 0,
                                "end": 240,
                                "step": 10
                            }
                        }
                    ],
                    "data_values": [
                        {
                            "name": "accel_x",
                            "description": "x-axis value",
                            "unit": "",
                            "byte_start": 0,
                            "byte_end": 4,
                            "size": 4,
                            "type": "int",
                            "multiplier": 0.000001,
                            "variable_type": "value",
                            "depends_on": null
                        },
                        {
                            "name": "accel_y",
                            "description": "y-axis value",
                            "unit": "",
                            "byte_start": 4,
                            "byte_end": 8,
                            "size": 4,
                            "type": "int",
                            "multiplier": 0.000001,
                            "variable_type": "value",
                            "depends_on": null
                        },
                        {
                            "name": "accel_z",
                            "description": "z-axis value",
                            "unit": "",
                            "byte_start": 8,
                            "byte_end": 12,
                            "size": 4,
                            "type": "int",
                            "multiplier": 0.000001,
                            "variable_type": "value",
                            "depends_on": null
                        }
                    ],
                    "ble": {
                        "service_uuid": "1a220003-c2ed-4d11-ad1e-fc06d8a02d37",
                        "data_char_uuid": "1a220005-c2ed-4d11-ad1e-fc06d8a02d37",
                        "config_char_uuid": "1a220004-c2ed-4d11-ad1e-fc06d8a02d37"
                    }
                },
                {
                    "id": "0xb94d",
                    "name": "random-number",
                    "description": "random number data stream to simulate a sensor, used for throughput testing",
                    "include_anchor_timestamp": true,
                    "offset_data_value": {
                        "name": "ms_offset",
                        "description": "relative time since the previous reading",
                        "unit": "ms",
                        "byte_start": 20,
                        "byte_end": 21,
                        "size": 1,
                        "type": "uint",
                        "multiplier": null,
                        "variable_type": "none"
                    },
                    "config_values": [
                        {
                            "name": "sensor_state",
                            "description": "state of the accelerometer sensor",
                            "byte_start": 0,
                            "byte_end": 1,
                            "size": 1,
                            "unit": null,
                            "type": "uint",
                            "default_value": "0",
                            "options": [
                                {
                                    "name": "disabled",
                                    "description": "the sensor will not stream data",
                                    "value": "0"
                                },
                                {
                                    "name": "streaming",
                                    "description": "the sensor will stream data",
                                    "value": "1"
                                }
                            ],
                            "range": null
                        },
                        {
                            "name": "desired_frequency",
                            "description": "the desired frequency of the sensor",
                            "byte_start": 1,
                            "byte_end": 3,
                            "size": 2,
                            "type": "uint",
                            "unit": "Hz",
                            "options": null,
                            "default_value":  "100",
                            "range": {
                                "start": 0,
                                "end": 1000,
                                "step": 50
                            }
                        }
                    ],
                    "data_values": [
                        {
                            "name": "value1",
                            "description": "random value #1",
                            "unit": "arb",
                            "byte_start": 0,
                            "byte_end": 2,
                            "size": 2,
                            "type": "uint",
                            "multiplier": null,
                            "variable_type": "value",
                            "depends_on": null
                        },
                        {
                            "name": "value2",
                            "description": "random value #2",
                            "unit": "arb",
                            "byte_start": 2,
                            "byte_end": 4,
                            "size": 2,
                            "type": "uint",
                            "multiplier": null,
                            "variable_type": "value",
                            "depends_on": null
                        },
                        {
                            "name": "value3",
                            "description": "random value #3",